[
	{
		"stopover_ID": "20190465",
		"status": "achieved",
		"port": {
			"ETA": "2018-11-13T20:00:00+00:00",
			"ETD": "2018-11-14T14:00:00+00:00",
			"terminal": "Bassens"
		},
		"boat": {
			"ID": "IMO1234567",
			"type": "cargo >500 tjb",
			"capacity": 15000,
			"label": "Boat's labelling (eg. name)"
		},
		"handlings": [
			{
				"type": "cargo",
				"dangerous": false,
				"agent": "Cargo's agent's name",
				"operator": "Cargo's operator's name",
				"dock": {
					"ID": "dock_432",
					"ETA": "2018-11-14T15:00:00+00:00",
					"ETD": "2018-11-16T07::00:00+00:00"
				},
				"content": {
					"direction": "unloading",
					"segment_type": "cereal",
					"type": "corn",
					"amount": 4560,
					"label": "Cargo's labelling (eg. short description)"
				}
			},
			{
				"type": "cargo",
				"dangerous": false,
				"agent": "Cargo's agent's name",
				"operator": "Cargo's operator's name",
				"dock": {
					"ID": "dock_432",
					"ETA": "2018-11-13T20:00:00+00:00",
					"ETD": "2018-11-18T20:00:00+00:00"
				},
				"content": {
					"direction": "loading",
					"segment_type": "cereal",
					"type": "maize",
					"amount": 7548,
					"label": "Cargo's labelling (eg. short description)"
				}
			}
		]
	},
	{
		"stopover_ID": "2019457",
		"status": "achieved",
		"port": {
			"ETA": "2018-11-13T21:00:00+00:00",
			"ETD": "2018-11-17T23:00:00+00:00",
			"terminal": "Bassens"
		},
		"boat": {
			"ID": "IMO7894561",
			"type": "PÃ©trolier double coque",
			"capacity": 15000,
			"label": "Boat's labelling (eg. name)"
		},
		"handlings": [
			{
				"type": "cargo",
				"dangerous": false,
				"agent": "Cargo's agent's name",
				"operator": "Cargo's operator's name",
				"dock": {
					"ID": "dock_411",
					"ETA": "2018-11-13T23:00:00+00:00",
					"ETD": "2018-11-17T22:00:00+00:00"
				},
				"content": {
					"direction": "loading",
					"segment_type": "Liq.V",
					"type": "Petrol",
					"amount": 11125,
					"label": "Cargo's labelling (eg. short description)"
				}
			}
		]
	}
]